{
  "schemaVersion": 1,
  "bindingId": "es.skill-evidence-binding.es-agent-mechanism-replication.v1",
  "skillName": "es-agent-mechanism-replication",
  "contract": {
    "id": "es.skill-evidence-receipt",
    "version": "1",
    "path": "ES/Automation/Contracts/es-skill-evidence-receipt-v1.schema.json",
    "hash": "9fbf168a71ff71c0b16d45ec8fdc18d7891a42b3c3f17638b28d3d3541b1f880"
  },
  "localContract": {
    "path": "",
    "hash": "",
    "mode": "central-authoritative"
  },
  "stableEntrypoint": {
    "path": "scripts/Test-ESSkillEvidence.ps1",
    "hash": "3222ee6aa698a95b13de38cbeb33015d9408294874f8bdd7643c252554a7d61a",
    "mode": "central-delegate",
    "centralValidatorPath": ".agents/skills/es-skill-governance/scripts/Test-ESStrictEvidenceReceipt.ps1"
  },
  "compatibility": {
    "legacyReadable": true,
    "legacyReceiptBeforeUtc": "2026-08-26T03:45:00Z",
    "legacyReceiptAcceptanceEndsUtc": "2026-09-02T03:45:00Z",
    "newReceiptBinding": "required",
    "retirementState": "not-authorized"
  }
} 
